08:20:12.519451 IP 192.168.0.100.58382 > 74.125.225.81.443: Flags [P.], seq 2438037014:2438037963, ack 437741478, win 8192, options [nop,nop,TS val 70087286 ecr 2787337473], length 949
08:20:12.593343 IP 192.168.0.100.58382 > 74.125.225.81.443: Flags [.], ack 1414, win 8103, options [nop,nop,TS val 70087359 ecr 2787346349], length 0
08:20:12.593755 IP 192.168.0.100.58382 > 74.125.225.81.443: Flags [.], ack 1643, win 8177, options [nop,nop,TS val 70087359 ecr 2787346349], length 0
08:20:12.715076 IP 192.168.0.100.58382 > 74.125.225.81.443: Flags [.], ack 3056, win 8103, options [nop,nop,TS val 70087480 ecr 2787346472], length 0
08:20:12.715951 IP 192.168.0.100.58382 > 74.125.225.81.443: Flags [.], ack 4469, win 8103, options [nop,nop,TS val 70087480 ecr 2787346472], length 0
08:20:12.716429 IP 192.168.0.100.58382 > 74.125.225.81.443: Flags [.], ack 5882, win 8103, options [nop,nop,TS val 70087481 ecr 2787346472], length 0
08:20:12.716528 IP 192.168.0.100.58382 > 74.125.225.81.443: Flags [.], ack 7295, win 8103, options [nop,nop,TS val 70087481 ecr 2787346472], length 0
08:20:12.717039 IP 192.168.0.100.58382 > 74.125.225.81.443: Flags [.], ack 8708, win 8103, options [nop,nop,TS val 70087481 ecr 2787346472], length 0
08:20:12.717748 IP 192.168.0.100.58382 > 74.125.225.81.443: Flags [.], ack 10121, win 8103, options [nop,nop,TS val 70087482 ecr 2787346472], length 0
08:20:12.717836 IP 192.168.0.100.58382 > 74.125.225.81.443: Flags [.], ack 11534, win 8103, options [nop,nop,TS val 70087482 ecr 2787346472], length 0
08:20:12.718432 IP 192.168.0.100.58382 > 74.125.225.81.443: Flags [.], ack 12947, win 8103, options [nop,nop,TS val 70087482 ecr 2787346472], length 0
08:20:12.718520 IP 192.168.0.100.58382 > 74.125.225.81.443: Flags [.], ack 14360, win 8103, options [nop,nop,TS val 70087482 ecr 2787346472], length 0
08:20:12.719032 IP 192.168.0.100.58382 > 74.125.225.81.443: Flags [.], ack 15693, win 8108, options [nop,nop,TS val 70087483 ecr 2787346472], length 0
08:20:12.721559 IP 192.168.0.100.58382 > 74.125.225.81.443: Flags [.], ack 17106, win 8103, options [nop,nop,TS val 70087485 ecr 2787346477], length 0
08:20:12.723597 IP 192.168.0.100.58382 > 74.125.225.81.443: Flags [.], ack 18519, win 8103, options [nop,nop,TS val 70087487 ecr 2787346477], length 0
08:20:12.723692 IP 192.168.0.100.58382 > 74.125.225.81.443: Flags [.], ack 19932, win 8103, options [nop,nop,TS val 70087487 ecr 2787346477], length 0
08:20:12.723810 IP 192.168.0.100.58382 > 74.125.225.81.443: Flags [.], ack 21345, win 8103, options [nop,nop,TS val 70087487 ecr 2787346477], length 0
08:20:12.723810 IP 192.168.0.100.58382 > 74.125.225.81.443: Flags [.], ack 22758, win 8015, options [nop,nop,TS val 70087487 ecr 2787346477], length 0
08:20:12.724651 IP 192.168.0.100.58382 > 74.125.225.81.443: Flags [.], ack 24171, win 8103, options [nop,nop,TS val 70087488 ecr 2787346477], length 0
08:20:12.724651 IP 192.168.0.100.58382 > 74.125.225.81.443: Flags [.], ack 25584, win 8015, options [nop,nop,TS val 70087488 ecr 2787346477], length 0
08:20:12.724664 IP 192.168.0.100.58382 > 74.125.225.81.443: Flags [.], ack 26997, win 7927, options [nop,nop,TS val 70087488 ecr 2787346477], length 0
08:20:12.724668 IP 192.168.0.100.58382 > 74.125.225.81.443: Flags [.], ack 28410, win 7838, options [nop,nop,TS val 70087488 ecr 2787346477], length 0
08:20:12.724672 IP 192.168.0.100.58382 > 74.125.225.81.443: Flags [.], ack 29823, win 7750, options [nop,nop,TS val 70087488 ecr 2787346477], length 0
08:20:12.724677 IP 192.168.0.100.58382 > 74.125.225.81.443: Flags [.], ack 29823, win 8192, options [nop,nop,TS val 70087488 ecr 2787346477], length 0
08:20:12.724696 IP 192.168.0.100.58382 > 74.125.225.81.443: Flags [.], ack 31236, win 8103, options [nop,nop,TS val 70087488 ecr 2787346477], length 0
08:20:12.724697 IP 192.168.0.100.58382 > 74.125.225.81.443: Flags [.], ack 32649, win 8015, options [nop,nop,TS val 70087488 ecr 2787346477], length 0
08:20:12.741930 IP 192.168.0.100.58382 > 74.125.225.81.443: Flags [.], ack 34067, win 8192, options [nop,nop,TS val 70087505 ecr 2787346499], length 0
08:20:12.743264 IP 192.168.0.100.58382 > 74.125.225.81.443: Flags [.], ack 34952, win 8136, options [nop,nop,TS val 70087506 ecr 2787346499], length 0
08:20:12.791098 IP 192.168.0.100.58382 > 74.125.225.81.443: Flags [.], seq 949:2367, ack 34952, win 8192, options [nop,nop,TS val 70087553 ecr 2787346499], length 1418
08:20:12.791099 IP 192.168.0.100.58382 > 74.125.225.81.443: Flags [P.], seq 2367:2522, ack 34952, win 8192, options [nop,nop,TS val 70087553 ecr 2787346499], length 155
08:20:12.829582 IP 192.168.0.100.58382 > 74.125.225.81.443: Flags [.], ack 35229, win 8174, options [nop,nop,TS val 70087589 ecr 2787346588], length 0
08:20:19.888577 IP 192.168.0.100.58382 > 74.125.225.81.443: Flags [P.], seq 2522:3503, ack 35229, win 8192, options [nop,nop,TS val 70094626 ecr 2787346588], length 981
08:20:19.961426 IP 192.168.0.100.58382 > 74.125.225.81.443: Flags [.], ack 36642, win 8103, options [nop,nop,TS val 70094698 ecr 2787353718], length 0
08:20:19.961427 IP 192.168.0.100.58382 > 74.125.225.81.443: Flags [.], ack 36919, win 8086, options [nop,nop,TS val 70094698 ecr 2787353718], length 0
08:20:20.251860 IP 192.168.0.100.58382 > 74.125.225.81.443: Flags [.], ack 38332, win 8103, options [nop,nop,TS val 70094987 ecr 2787353948], length 0
08:20:20.252187 IP 192.168.0.100.58382 > 74.125.225.81.443: Flags [.], ack 39745, win 8103, options [nop,nop,TS val 70094987 ecr 2787353948], length 0
08:20:20.252254 IP 192.168.0.100.58382 > 74.125.225.81.443: Flags [.], ack 41158, win 8015, options [nop,nop,TS val 70094987 ecr 2787353948], length 0
08:20:20.255269 IP 192.168.0.100.58382 > 74.125.225.81.443: Flags [.], ack 42571, win 8103, options [nop,nop,TS val 70094990 ecr 2787353948], length 0
08:20:20.255270 IP 192.168.0.100.58382 > 74.125.225.81.443: Flags [.], ack 43984, win 8015, options [nop,nop,TS val 70094990 ecr 2787353948], length 0
08:20:20.255270 IP 192.168.0.100.58382 > 74.125.225.81.443: Flags [.], ack 45397, win 7927, options [nop,nop,TS val 70094990 ecr 2787353948], length 0
08:20:20.255270 IP 192.168.0.100.58382 > 74.125.225.81.443: Flags [.], ack 46810, win 7838, options [nop,nop,TS val 70094990 ecr 2787353948], length 0
08:20:20.255270 IP 192.168.0.100.58382 > 74.125.225.81.443: Flags [.], ack 48223, win 7750, options [nop,nop,TS val 70094990 ecr 2787353948], length 0
08:20:20.255317 IP 192.168.0.100.58382 > 74.125.225.81.443: Flags [.], ack 49636, win 7662, options [nop,nop,TS val 70094990 ecr 2787353948], length 0
08:20:20.255317 IP 192.168.0.100.58382 > 74.125.225.81.443: Flags [.], ack 49865, win 7647, options [nop,nop,TS val 70094990 ecr 2787353948], length 0
08:20:20.255317 IP 192.168.0.100.58382 > 74.125.225.81.443: Flags [.], ack 49865, win 8192, options [nop,nop,TS val 70094990 ecr 2787353948], length 0
08:20:20.255318 IP 192.168.0.100.58382 > 74.125.225.81.443: Flags [.], ack 51278, win 8103, options [nop,nop,TS val 70094990 ecr 2787353953], length 0
08:20:20.255318 IP 192.168.0.100.58382 > 74.125.225.81.443: Flags [.], ack 52691, win 8015, options [nop,nop,TS val 70094990 ecr 2787353953], length 0
08:20:20.255318 IP 192.168.0.100.58382 > 74.125.225.81.443: Flags [.], ack 54104, win 7927, options [nop,nop,TS val 70094990 ecr 2787353953], length 0
08:20:20.255318 IP 192.168.0.100.58382 > 74.125.225.81.443: Flags [.], ack 55517, win 7838, options [nop,nop,TS val 70094990 ecr 2787353953], length 0
08:20:20.255339 IP 192.168.0.100.58382 > 74.125.225.81.443: Flags [.], ack 56930, win 7750, options [nop,nop,TS val 70094990 ecr 2787353953], length 0
08:20:20.255339 IP 192.168.0.100.58382 > 74.125.225.81.443: Flags [.], ack 58343, win 7662, options [nop,nop,TS val 70094990 ecr 2787353953], length 0
08:20:20.255339 IP 192.168.0.100.58382 > 74.125.225.81.443: Flags [.], ack 58476, win 7653, options [nop,nop,TS val 70094990 ecr 2787353953], length 0
08:20:20.255339 IP 192.168.0.100.58382 > 74.125.225.81.443: Flags [.], ack 59889, win 7565, options [nop,nop,TS val 70094990 ecr 2787353975], length 0
08:20:20.255351 IP 192.168.0.100.58382 > 74.125.225.81.443: Flags [.], ack 61302, win 7477, options [nop,nop,TS val 70094990 ecr 2787353975], length 0
08:20:20.255351 IP 192.168.0.100.58382 > 74.125.225.81.443: Flags [.], ack 62715, win 7388, options [nop,nop,TS val 70094990 ecr 2787353975], length 0
08:20:20.255351 IP 192.168.0.100.58382 > 74.125.225.81.443: Flags [.], ack 64128, win 7300, options [nop,nop,TS val 70094990 ecr 2787353975], length 0
08:20:20.255470 IP 192.168.0.100.58382 > 74.125.225.81.443: Flags [.], ack 65141, win 7237, options [nop,nop,TS val 70094990 ecr 2787353975], length 0
08:20:20.255471 IP 192.168.0.100.58382 > 74.125.225.81.443: Flags [.], ack 65141, win 8192, options [nop,nop,TS val 70094990 ecr 2787353975], length 0
08:20:20.270919 IP 192.168.0.100.58382 > 74.125.225.81.443: Flags [.], ack 65141, win 8192, options [nop,nop,TS val 70095005 ecr 2787353975], length 0
08:20:20.325723 IP 192.168.0.100.58382 > 74.125.225.81.443: Flags [P.], seq 3503:4276, ack 65141, win 8192, options [nop,nop,TS val 70095059 ecr 2787353975], length 773
08:20:20.350825 IP 192.168.0.100.58382 > 74.125.225.81.443: Flags [.], ack 66554, win 8103, options [nop,nop,TS val 70095083 ecr 2787354105], length 0
08:20:20.351202 IP 192.168.0.100.58382 > 74.125.225.81.443: Flags [.], ack 67967, win 8103, options [nop,nop,TS val 70095083 ecr 2787354105], length 0
08:20:20.351226 IP 192.168.0.100.58382 > 74.125.225.81.443: Flags [.], ack 68980, win 8128, options [nop,nop,TS val 70095083 ecr 2787354105], length 0
08:20:20.390526 IP 192.168.0.100.58382 > 74.125.225.81.443: Flags [.], seq 4276:5694, ack 68980, win 8192, options [nop,nop,TS val 70095122 ecr 2787354105], length 1418
08:20:20.390526 IP 192.168.0.100.58382 > 74.125.225.81.443: Flags [P.], seq 5694:5865, ack 68980, win 8192, options [nop,nop,TS val 70095122 ecr 2787354105], length 171
08:20:20.431219 IP 192.168.0.100.58382 > 74.125.225.81.443: Flags [.], ack 69257, win 8174, options [nop,nop,TS val 70095161 ecr 2787354189], length 0
08:20:52.381216 IP 192.168.0.100.58377 > 74.125.225.81.443: Flags [P.], seq 3759516701:3759516754, ack 528241818, win 8901, options [nop,nop,TS val 70126695 ecr 2787314106], length 53
08:20:52.381217 IP 192.168.0.100.58377 > 74.125.225.81.443: Flags [F.], seq 53, ack 1, win 8901, options [nop,nop,TS val 70126695 ecr 2787314106], length 0
08:20:52.381798 IP 192.168.0.100.58382 > 74.125.225.81.443: Flags [P.], seq 5865:5918, ack 69257, win 8192, options [nop,nop,TS val 70126695 ecr 2787354189], length 53
08:20:52.381835 IP 192.168.0.100.58382 > 74.125.225.81.443: Flags [F.], seq 5918, ack 69257, win 8192, options [nop,nop,TS val 70126695 ecr 2787354189], length 0
08:20:52.408862 IP 192.168.0.100.58382 > 74.125.225.81.443: Flags [.], ack 69258, win 8192, options [nop,nop,TS val 70126717 ecr 2787386165], length 0
08:20:52.409364 IP 192.168.0.100.58377 > 74.125.225.81.443: Flags [.], ack 2, win 8901, options [nop,nop,TS val 70126717 ecr 2787370697], length 0
