08:20:25.944819 IP 192.168.0.100.58390 > 205.251.242.54.http: Flags [S], seq 2965930280, win 65535, options [mss 1460,nop,wscale 4,nop,nop,TS val 70100647 ecr 0,sackOK,eol], length 0
08:20:25.994041 IP 205.251.242.54.http > 192.168.0.100.58390: Flags [S.], seq 2071763525, ack 2965930281, win 8190, options [mss 1460,nop,wscale 6], length 0
08:20:25.994189 IP 192.168.0.100.58390 > 205.251.242.54.http: Flags [.], ack 1, win 16384, length 0
08:20:25.995429 IP 192.168.0.100.58390 > 205.251.242.54.http: Flags [P.], seq 1:829, ack 1, win 16384, length 828: HTTP: GET / HTTP/1.1
08:20:26.039920 IP 205.251.242.54.http > 192.168.0.100.58390: Flags [.], ack 829, win 32768, length 0
08:20:26.118809 IP 205.251.242.54.http > 192.168.0.100.58390: Flags [.], seq 1:1461, ack 829, win 32768, length 1460: HTTP: HTTP/1.1 200 OK
08:20:26.119637 IP 205.251.242.54.http > 192.168.0.100.58390: Flags [P.], seq 1461:2882, ack 829, win 32768, length 1421: HTTP
08:20:26.119695 IP 192.168.0.100.58390 > 205.251.242.54.http: Flags [.], ack 2882, win 16295, length 0
08:20:26.126221 IP 205.251.242.54.http > 192.168.0.100.58390: Flags [.], seq 2882:4342, ack 829, win 32768, length 1460: HTTP
08:20:26.126225 IP 205.251.242.54.http > 192.168.0.100.58390: Flags [P.], seq 4342:4349, ack 829, win 32768, length 7: HTTP
08:20:26.126288 IP 192.168.0.100.58390 > 205.251.242.54.http: Flags [.], ack 4349, win 16292, length 0
08:20:26.126371 IP 205.251.242.54.http > 192.168.0.100.58390: Flags [.], seq 4349:5809, ack 829, win 32768, length 1460: HTTP
08:20:26.126373 IP 205.251.242.54.http > 192.168.0.100.58390: Flags [P.], seq 5809:5816, ack 829, win 32768, length 7: HTTP
08:20:26.126431 IP 205.251.242.54.http > 192.168.0.100.58390: Flags [P.], seq 5816:6667, ack 829, win 32768, length 851: HTTP
08:20:26.126445 IP 192.168.0.100.58390 > 205.251.242.54.http: Flags [.], ack 5816, win 16292, length 0
08:20:26.126455 IP 192.168.0.100.58390 > 205.251.242.54.http: Flags [.], ack 6667, win 16239, length 0
08:20:26.127657 IP 205.251.242.54.http > 192.168.0.100.58390: Flags [.], seq 6667:8127, ack 829, win 32768, length 1460: HTTP
08:20:26.127739 IP 192.168.0.100.58390 > 205.251.242.54.http: Flags [.], ack 8127, win 16384, length 0
08:20:26.127815 IP 205.251.242.54.http > 192.168.0.100.58390: Flags [P.], seq 8127:8549, ack 829, win 32768, length 422: HTTP
08:20:26.127867 IP 192.168.0.100.58390 > 205.251.242.54.http: Flags [.], ack 8549, win 16357, length 0
08:20:26.129528 IP 205.251.242.54.http > 192.168.0.100.58390: Flags [P.], seq 8549:9196, ack 829, win 32768, length 647: HTTP
08:20:26.129575 IP 192.168.0.100.58390 > 205.251.242.54.http: Flags [.], ack 9196, win 16343, length 0
08:20:26.265792 IP 205.251.242.54.http > 192.168.0.100.58390: Flags [.], seq 9196:10656, ack 829, win 32768, length 1460: HTTP
08:20:26.266389 IP 205.251.242.54.http > 192.168.0.100.58390: Flags [P.], seq 10656:10658, ack 829, win 32768, length 2: HTTP
08:20:26.266394 IP 205.251.242.54.http > 192.168.0.100.58390: Flags [P.], seq 10658:11139, ack 829, win 32768, length 481: HTTP
08:20:26.266460 IP 192.168.0.100.58390 > 205.251.242.54.http: Flags [.], ack 10658, win 16383, length 0
08:20:26.266461 IP 192.168.0.100.58390 > 205.251.242.54.http: Flags [.], ack 11139, win 16353, length 0
08:20:26.273359 IP 192.168.0.100.58392 > 23.3.96.123.http: Flags [S], seq 581446122, win 65535, options [mss 1460,nop,wscale 4,nop,nop,TS val 70100968 ecr 0,sackOK,eol], length 0
08:20:26.273359 IP 192.168.0.100.58391 > 23.3.96.123.http: Flags [S], seq 3108582718, win 65535, options [mss 1460,nop,wscale 4,nop,nop,TS val 70100968 ecr 0,sackOK,eol], length 0
08:20:26.273518 IP 192.168.0.100.58393 > 23.3.96.123.http: Flags [S], seq 2952687397, win 65535, options [mss 1460,nop,wscale 4,nop,nop,TS val 70100968 ecr 0,sackOK,eol], length 0
08:20:26.276183 IP 205.251.242.54.http > 192.168.0.100.58390: Flags [.], seq 11139:12599, ack 829, win 32768, length 1460: HTTP
08:20:26.276675 IP 205.251.242.54.http > 192.168.0.100.58390: Flags [P.], seq 12599:12866, ack 829, win 32768, length 267: HTTP
08:20:26.276718 IP 192.168.0.100.58390 > 205.251.242.54.http: Flags [.], ack 12866, win 16367, length 0
08:20:26.277026 IP 205.251.242.54.http > 192.168.0.100.58390: Flags [P.], seq 12866:14014, ack 829, win 32768, length 1148: HTTP
08:20:26.277060 IP 192.168.0.100.58390 > 205.251.242.54.http: Flags [.], ack 14014, win 16312, length 0
08:20:26.278033 IP 205.251.242.54.http > 192.168.0.100.58390: Flags [.], seq 14014:15474, ack 829, win 32768, length 1460: HTTP
08:20:26.279294 IP 205.251.242.54.http > 192.168.0.100.58390: Flags [P.], seq 15474:15925, ack 829, win 32768, length 451: HTTP
08:20:26.279331 IP 192.168.0.100.58390 > 205.251.242.54.http: Flags [.], ack 15925, win 16355, length 0
08:20:26.282546 IP 205.251.242.54.http > 192.168.0.100.58390: Flags [.], seq 15925:17385, ack 829, win 32768, length 1460: HTTP
08:20:26.282549 IP 205.251.242.54.http > 192.168.0.100.58390: Flags [P.], seq 17385:17387, ack 829, win 32768, length 2: HTTP
08:20:26.282626 IP 205.251.242.54.http > 192.168.0.100.58390: Flags [P.], seq 17387:18540, ack 829, win 32768, length 1153: HTTP
08:20:26.282641 IP 192.168.0.100.58390 > 205.251.242.54.http: Flags [.], ack 17387, win 16292, length 0
08:20:26.282666 IP 192.168.0.100.58390 > 205.251.242.54.http: Flags [.], ack 18540, win 16220, length 0
08:20:26.288608 IP 205.251.242.54.http > 192.168.0.100.58390: Flags [P.], seq 18540:19923, ack 829, win 32768, length 1383: HTTP
08:20:26.288652 IP 192.168.0.100.58390 > 205.251.242.54.http: Flags [.], ack 19923, win 16297, length 0
08:20:26.296914 IP 23.3.96.123.http > 192.168.0.100.58392: Flags [S.], seq 48926739, ack 581446123, win 14480, options [mss 1460,sackOK,TS val 1349529916 ecr 70100968,nop,wscale 1], length 0
08:20:26.296980 IP 192.168.0.100.58392 > 23.3.96.123.http: Flags [.], ack 1, win 8235, options [nop,nop,TS val 70100990 ecr 1349529916], length 0
08:20:26.298077 IP 192.168.0.100.58392 > 23.3.96.123.http: Flags [P.], seq 1:405, ack 1, win 8235, options [nop,nop,TS val 70100991 ecr 1349529916], length 404: HTTP: GET /images/G/01/browser-scripts/us-site-wide-css-beacon/site-wide-5436026583._V1_.css HTTP/1.1
08:20:26.300361 IP 23.3.96.123.http > 192.168.0.100.58391: Flags [S.], seq 4263703858, ack 3108582719, win 14480, options [mss 1460,sackOK,TS val 1349529920 ecr 70100968,nop,wscale 1], length 0
08:20:26.300425 IP 192.168.0.100.58391 > 23.3.96.123.http: Flags [.], ack 1, win 8235, options [nop,nop,TS val 70100993 ecr 1349529920], length 0
08:20:26.301128 IP 23.3.96.123.http > 192.168.0.100.58393: Flags [S.], seq 3889382572, ack 2952687398, win 14480, options [mss 1460,sackOK,TS val 1349529920 ecr 70100968,nop,wscale 1], length 0
08:20:26.301141 IP 192.168.0.100.58391 > 23.3.96.123.http: Flags [P.], seq 1:413, ack 1, win 8235, options [nop,nop,TS val 70100993 ecr 1349529920], length 412: HTTP: GET /images/G/01/browser-scripts/navbarCSSUS-beacon/navbarCSSUS-beacon-min-2741766142._V1_.css HTTP/1.1
08:20:26.301174 IP 192.168.0.100.58393 > 23.3.96.123.http: Flags [.], ack 1, win 8235, options [nop,nop,TS val 70100993 ecr 1349529920], length 0
08:20:26.301669 IP 192.168.0.100.58393 > 23.3.96.123.http: Flags [P.], seq 1:406, ack 1, win 8235, options [nop,nop,TS val 70100994 ecr 1349529920], length 405: HTTP: GET /images/G/01/nav2/gamma/websiteGridCSS/websiteGridCSS-websiteGridCSS-14209._V1_.css HTTP/1.1
08:20:26.322744 IP 23.3.96.123.http > 192.168.0.100.58392: Flags [.], ack 405, win 7776, options [nop,nop,TS val 1349529942 ecr 70100991], length 0
08:20:26.323934 IP 23.3.96.123.http > 192.168.0.100.58392: Flags [.], seq 1:1449, ack 405, win 7776, options [nop,nop,TS val 1349529942 ecr 70100991], length 1448: HTTP: HTTP/1.1 200 OK
08:20:26.324104 IP 23.3.96.123.http > 192.168.0.100.58392: Flags [P.], seq 1449:1912, ack 405, win 7776, options [nop,nop,TS val 1349529942 ecr 70100991], length 463: HTTP
08:20:26.324164 IP 192.168.0.100.58392 > 23.3.96.123.http: Flags [.], ack 1912, win 8163, options [nop,nop,TS val 70101016 ecr 1349529942], length 0
08:20:26.330916 IP 23.3.96.123.http > 192.168.0.100.58391: Flags [.], ack 413, win 7776, options [nop,nop,TS val 1349529946 ecr 70100993], length 0
08:20:26.331053 IP 23.3.96.123.http > 192.168.0.100.58393: Flags [.], ack 406, win 7776, options [nop,nop,TS val 1349529946 ecr 70100994], length 0
08:20:26.337732 IP 23.3.96.123.http > 192.168.0.100.58391: Flags [.], seq 1449:2897, ack 413, win 7776, options [nop,nop,TS val 1349529947 ecr 70100993], length 1448: HTTP
08:20:26.337738 IP 23.3.96.123.http > 192.168.0.100.58391: Flags [.], seq 2897:4345, ack 413, win 7776, options [nop,nop,TS val 1349529947 ecr 70100993], length 1448: HTTP
08:20:26.337824 IP 192.168.0.100.58391 > 23.3.96.123.http: Flags [.], ack 1, win 8235, options [nop,nop,TS val 70101028 ecr 1349529946,nop,nop,sack 1 {1449:2897}], length 0
08:20:26.337825 IP 192.168.0.100.58391 > 23.3.96.123.http: Flags [.], ack 1, win 8235, options [nop,nop,TS val 70101028 ecr 1349529946,nop,nop,sack 1 {1449:4345}], length 0
08:20:26.337918 IP 23.3.96.123.http > 192.168.0.100.58391: Flags [.], seq 4345:5793, ack 413, win 7776, options [nop,nop,TS val 1349529947 ecr 70100993], length 1448: HTTP
08:20:26.337976 IP 192.168.0.100.58391 > 23.3.96.123.http: Flags [.], ack 1, win 8235, options [nop,nop,TS val 70101028 ecr 1349529946,nop,nop,sack 1 {1449:5793}], length 0
08:20:26.338071 IP 23.3.96.123.http > 192.168.0.100.58391: Flags [.], seq 5793:7241, ack 413, win 7776, options [nop,nop,TS val 1349529947 ecr 70100993], length 1448: HTTP
08:20:26.338118 IP 192.168.0.100.58391 > 23.3.96.123.http: Flags [.], ack 1, win 8235, options [nop,nop,TS val 70101028 ecr 1349529946,nop,nop,sack 1 {1449:7241}], length 0
08:20:26.338173 IP 23.3.96.123.http > 192.168.0.100.58391: Flags [.], seq 7241:8689, ack 413, win 7776, options [nop,nop,TS val 1349529947 ecr 70100993], length 1448: HTTP
08:20:26.338206 IP 192.168.0.100.58391 > 23.3.96.123.http: Flags [.], ack 1, win 8235, options [nop,nop,TS val 70101028 ecr 1349529946,nop,nop,sack 1 {1449:8689}], length 0
08:20:26.338356 IP 23.3.96.123.http > 192.168.0.100.58391: Flags [.], seq 8689:10137, ack 413, win 7776, options [nop,nop,TS val 1349529947 ecr 70100993], length 1448: HTTP
08:20:26.338359 IP 23.3.96.123.http > 192.168.0.100.58391: Flags [.], seq 10137:11585, ack 413, win 7776, options [nop,nop,TS val 1349529947 ecr 70100993], length 1448: HTTP
08:20:26.338389 IP 192.168.0.100.58391 > 23.3.96.123.http: Flags [.], ack 1, win 8235, options [nop,nop,TS val 70101028 ecr 1349529946,nop,nop,sack 1 {1449:10137}], length 0
08:20:26.338406 IP 192.168.0.100.58391 > 23.3.96.123.http: Flags [.], ack 1, win 8235, options [nop,nop,TS val 70101028 ecr 1349529946,nop,nop,sack 1 {1449:11585}], length 0
08:20:26.338525 IP 23.3.96.123.http > 192.168.0.100.58391: Flags [.], seq 11585:13033, ack 413, win 7776, options [nop,nop,TS val 1349529947 ecr 70100993], length 1448: HTTP
08:20:26.338556 IP 192.168.0.100.58391 > 23.3.96.123.http: Flags [.], ack 1, win 8235, options [nop,nop,TS val 70101028 ecr 1349529946,nop,nop,sack 1 {1449:13033}], length 0
08:20:26.338648 IP 23.3.96.123.http > 192.168.0.100.58391: Flags [.], seq 1:1449, ack 413, win 7776, options [nop,nop,TS val 1349529947 ecr 70100993], length 1448: HTTP: HTTP/1.1 200 OK
08:20:26.338698 IP 192.168.0.100.58391 > 23.3.96.123.http: Flags [.], ack 13033, win 7421, options [nop,nop,TS val 70101028 ecr 1349529947], length 0
08:20:26.338832 IP 23.3.96.123.http > 192.168.0.100.58391: Flags [.], seq 13033:14481, ack 413, win 7776, options [nop,nop,TS val 1349529947 ecr 70100993], length 1448: HTTP
08:20:26.338854 IP 192.168.0.100.58391 > 23.3.96.123.http: Flags [.], ack 13033, win 7633, options [nop,nop,TS val 70101029 ecr 1349529947], length 0
08:20:26.338975 IP 23.3.96.123.http > 192.168.0.100.58391: Flags [.], seq 14481:15929, ack 413, win 7776, options [nop,nop,TS val 1349529947 ecr 70100993], length 1448: HTTP
08:20:26.338998 IP 192.168.0.100.58391 > 23.3.96.123.http: Flags [.], ack 15929, win 7452, options [nop,nop,TS val 70101029 ecr 1349529947], length 0
08:20:26.339119 IP 23.3.96.123.http > 192.168.0.100.58393: Flags [.], seq 1:1449, ack 406, win 7776, options [nop,nop,TS val 1349529947 ecr 70100994], length 1448: HTTP: HTTP/1.1 200 OK
08:20:26.339127 IP 192.168.0.100.58391 > 23.3.96.123.http: Flags [.], ack 15929, win 8192, options [nop,nop,TS val 70101029 ecr 1349529947], length 0
08:20:26.339255 IP 23.3.96.123.http > 192.168.0.100.58393: Flags [.], seq 1449:2897, ack 406, win 7776, options [nop,nop,TS val 1349529947 ecr 70100994], length 1448: HTTP
08:20:26.339281 IP 192.168.0.100.58393 > 23.3.96.123.http: Flags [.], ack 2897, win 8054, options [nop,nop,TS val 70101029 ecr 1349529947], length 0
08:20:26.341112 IP 23.3.96.123.http > 192.168.0.100.58393: Flags [.], seq 2897:4345, ack 406, win 7776, options [nop,nop,TS val 1349529947 ecr 70100994], length 1448: HTTP
08:20:26.341245 IP 23.3.96.123.http > 192.168.0.100.58393: Flags [P.], seq 4345:5671, ack 406, win 7776, options [nop,nop,TS val 1349529947 ecr 70100994], length 1326: HTTP
08:20:26.341253 IP 192.168.0.100.58393 > 23.3.96.123.http: Flags [.], ack 4345, win 8192, options [nop,nop,TS val 70101031 ecr 1349529947], length 0
08:20:26.341298 IP 192.168.0.100.58393 > 23.3.96.123.http: Flags [.], ack 5671, win 8109, options [nop,nop,TS val 70101031 ecr 1349529947], length 0
08:20:26.341344 IP 23.3.96.123.http > 192.168.0.100.58391: Flags [P.], seq 15929:17093, ack 413, win 7776, options [nop,nop,TS val 1349529947 ecr 70100993], length 1164: HTTP
08:20:26.341384 IP 192.168.0.100.58391 > 23.3.96.123.http: Flags [.], ack 17093, win 8119, options [nop,nop,TS val 70101031 ecr 1349529947], length 0
08:20:26.342681 IP 205.251.242.54.http > 192.168.0.100.58390: Flags [P.], seq 19923:20800, ack 829, win 32768, length 877: HTTP
08:20:26.342725 IP 192.168.0.100.58390 > 205.251.242.54.http: Flags [.], ack 20800, win 16329, length 0
08:20:26.353913 IP 205.251.242.54.http > 192.168.0.100.58390: Flags [.], seq 20800:22260, ack 829, win 32768, length 1460: HTTP
08:20:26.354070 IP 205.251.242.54.http > 192.168.0.100.58390: Flags [P.], seq 22260:22404, ack 829, win 32768, length 144: HTTP
08:20:26.354115 IP 192.168.0.100.58390 > 205.251.242.54.http: Flags [.], ack 22404, win 16375, length 0
08:20:26.365801 IP 23.3.96.123.http > 192.168.0.100.58391: Flags [.], seq 1:1449, ack 413, win 7776, options [nop,nop,TS val 1349529984 ecr 70101028], length 1448: HTTP: HTTP/1.1 200 OK
08:20:26.365863 IP 192.168.0.100.58391 > 23.3.96.123.http: Flags [.], ack 17093, win 8192, options [nop,nop,TS val 70101054 ecr 1349529947], length 0
08:20:26.408637 IP 192.168.0.100.58394 > 74.125.225.91.http: Flags [S], seq 3454894254, win 65535, options [mss 1460,nop,wscale 4,nop,nop,TS val 70101095 ecr 0,sackOK,eol], length 0
08:20:26.433208 IP 74.125.225.91.http > 192.168.0.100.58394: Flags [S.], seq 1978110500, ack 3454894255, win 42540, options [mss 1430,sackOK,TS val 2787361315 ecr 70101095,nop,wscale 6], length 0
08:20:26.433342 IP 192.168.0.100.58394 > 74.125.225.91.http: Flags [.], ack 1, win 8242, options [nop,nop,TS val 70101119 ecr 2787361315], length 0
08:20:26.434616 IP 192.168.0.100.58394 > 74.125.225.91.http: Flags [P.], seq 1:629, ack 1, win 8242, options [nop,nop,TS val 70101120 ecr 2787361315], length 628: HTTP: GET /N4215/adj/amzn.us.gw.atf;sz=300x250;oe=ISO-8859-1;bn=507846;u=822c6c99198e4a69bf029ea18f39e1ff;s=i0;s=i1;s=i2;s=i3;s=i4;s=i6;s=i7;s=i8;s=i9;s=m1;s=m4;s=u4;s=u13;s=u11;s=u88;z=3;s=3072;s=32;s=1009;s=3717;dc_ref=http%3A%2F%2Fwww.amazon.com;tile=1;ord=6422802079468? HTTP/1.1
08:20:26.457962 IP 74.125.225.91.http > 192.168.0.100.58394: Flags [.], ack 629, win 661, options [nop,nop,TS val 2787361344 ecr 70101120], length 0
08:20:26.498030 IP 74.125.225.91.http > 192.168.0.100.58394: Flags [P.], seq 1:1157, ack 629, win 661, options [nop,nop,TS val 2787361383 ecr 70101120], length 1156: HTTP: HTTP/1.1 200 OK
08:20:26.498153 IP 192.168.0.100.58394 > 74.125.225.91.http: Flags [.], ack 1157, win 8169, options [nop,nop,TS val 70101182 ecr 2787361383], length 0
08:20:26.501263 IP 192.168.0.100.58394 > 74.125.225.91.http: Flags [P.], seq 629:1503, ack 1157, win 8192, options [nop,nop,TS val 70101185 ecr 2787361383], length 874: HTTP: GET /adi/N6595.160337.AMAZON.COM/B7971983.30;sz=300x250;click=http://adclick.g.doubleclick.net/aclk?sa=L&ai=B2khAygALU8DJHLPewQH_loGwB76t2Y0FAAAAEAEgADgAWN64yuxzYMnW2Y38pPgUggEXY2EtcHViLTk2Nzc3ODA3MjM0OTQ2NjayAQ53d3cuYW1hem9uLmNvbboBCWdmcF9pbWFnZcgBCdoBFmh0dHA6Ly93d3cuYW1hem9uLmNvbS_AAgLgAgDqAhM0MjE1L2Ftem4udXMuZ3cuYXRm-AKC0h6QA-gCmAOkA6gDAdAEkE7gBAGgBh8&num=0&sig=AOD64_2W6Vi630UUJURlnK38ZO3GMs34Jw&client=ca-pub-9677780723494666&adurl=;ord=310872418? HTTP/1.1
08:20:26.537827 IP 205.251.242.54.http > 192.168.0.100.58390: Flags [P.], seq 22404:23504, ack 829, win 32768, length 1100: HTTP
08:20:26.537891 IP 192.168.0.100.58390 > 205.251.242.54.http: Flags [.], ack 23504, win 16315, length 0
08:20:26.537986 IP 205.251.242.54.http > 192.168.0.100.58390: Flags [P.], seq 23504:24935, ack 829, win 32768, length 1431: HTTP
08:20:26.538022 IP 192.168.0.100.58390 > 205.251.242.54.http: Flags [.], ack 24935, win 16294, length 0
08:20:26.538129 IP 205.251.242.54.http > 192.168.0.100.58390: Flags [P.], seq 24935:26258, ack 829, win 32768, length 1323: HTTP
08:20:26.538174 IP 192.168.0.100.58390 > 205.251.242.54.http: Flags [.], ack 26258, win 16301, length 0
08:20:26.539627 IP 205.251.242.54.http > 192.168.0.100.58390: Flags [.], seq 26258:27718, ack 829, win 32768, length 1460: HTTP
08:20:26.539630 IP 205.251.242.54.http > 192.168.0.100.58390: Flags [P.], seq 27718:27943, ack 829, win 32768, length 225: HTTP
08:20:26.539666 IP 192.168.0.100.58390 > 205.251.242.54.http: Flags [.], ack 27943, win 16278, length 0
08:20:26.539806 IP 205.251.242.54.http > 192.168.0.100.58390: Flags [.], seq 27943:29403, ack 829, win 32768, length 1460: HTTP
08:20:26.539808 IP 205.251.242.54.http > 192.168.0.100.58390: Flags [P.], seq 29403:29579, ack 829, win 32768, length 176: HTTP
08:20:26.539833 IP 192.168.0.100.58390 > 205.251.242.54.http: Flags [.], ack 29579, win 16281, length 0
08:20:26.539965 IP 205.251.242.54.http > 192.168.0.100.58390: Flags [P.], seq 29579:30760, ack 829, win 32768, length 1181: HTTP
08:20:26.540001 IP 192.168.0.100.58390 > 205.251.242.54.http: Flags [.], ack 30760, win 16310, length 0
08:20:26.540145 IP 205.251.242.54.http > 192.168.0.100.58390: Flags [.], seq 30760:32220, ack 829, win 32768, length 1460: HTTP
08:20:26.540150 IP 205.251.242.54.http > 192.168.0.100.58390: Flags [P.], seq 32220:32222, ack 829, win 32768, length 2: HTTP
08:20:26.540187 IP 205.251.242.54.http > 192.168.0.100.58390: Flags [P.], seq 32222:32749, ack 829, win 32768, length 527: HTTP
08:20:26.540195 IP 192.168.0.100.58390 > 205.251.242.54.http: Flags [.], ack 32222, win 16292, length 0
08:20:26.540235 IP 192.168.0.100.58390 > 205.251.242.54.http: Flags [.], ack 32749, win 16259, length 0
08:20:26.540362 IP 205.251.242.54.http > 192.168.0.100.58390: Flags [.], seq 32749:34209, ack 829, win 32768, length 1460: HTTP
08:20:26.540366 IP 205.251.242.54.http > 192.168.0.100.58390: Flags [P.], seq 34209:34211, ack 829, win 32768, length 2: HTTP
08:20:26.540422 IP 205.251.242.54.http > 192.168.0.100.58390: Flags [P.], seq 34211:34763, ack 829, win 32768, length 552: HTTP
08:20:26.540434 IP 192.168.0.100.58390 > 205.251.242.54.http: Flags [.], ack 34211, win 16292, length 0
08:20:26.540461 IP 192.168.0.100.58390 > 205.251.242.54.http: Flags [.], ack 34763, win 16258, length 0
08:20:26.541432 IP 205.251.242.54.http > 192.168.0.100.58390: Flags [.], seq 34763:36223, ack 829, win 32768, length 1460: HTTP
08:20:26.541529 IP 192.168.0.100.58390 > 205.251.242.54.http: Flags [.], ack 36223, win 16384, length 0
08:20:26.541966 IP 205.251.242.54.http > 192.168.0.100.58390: Flags [P.], seq 36223:36638, ack 829, win 32768, length 415: HTTP
08:20:26.541997 IP 192.168.0.100.58390 > 205.251.242.54.http: Flags [.], ack 36638, win 16358, length 0
08:20:26.542132 IP 205.251.242.54.http > 192.168.0.100.58390: Flags [.], seq 36638:38098, ack 829, win 32768, length 1460: HTTP
08:20:26.542191 IP 205.251.242.54.http > 192.168.0.100.58390: Flags [P.], seq 38098:38432, ack 829, win 32768, length 334: HTTP
08:20:26.542234 IP 192.168.0.100.58390 > 205.251.242.54.http: Flags [.], ack 38432, win 16271, length 0
08:20:26.542330 IP 205.251.242.54.http > 192.168.0.100.58390: Flags [.], seq 38432:39892, ack 829, win 32768, length 1460: HTTP
08:20:26.542434 IP 192.168.0.100.58390 > 205.251.242.54.http: Flags [.], ack 39892, win 16384, length 0
08:20:26.542802 IP 205.251.242.54.http > 192.168.0.100.58390: Flags [P.], seq 39892:39894, ack 829, win 32768, length 2: HTTP
08:20:26.542832 IP 192.168.0.100.58390 > 205.251.242.54.http: Flags [.], ack 39894, win 16383, length 0
08:20:26.542878 IP 205.251.242.54.http > 192.168.0.100.58390: Flags [P.], seq 39894:40631, ack 829, win 32768, length 737: HTTP
08:20:26.542899 IP 192.168.0.100.58390 > 205.251.242.54.http: Flags [.], ack 40631, win 16337, length 0
08:20:26.543019 IP 205.251.242.54.http > 192.168.0.100.58390: Flags [.], seq 40631:42091, ack 829, win 32768, length 1460: HTTP
08:20:26.564231 IP 74.125.225.91.http > 192.168.0.100.58394: Flags [.], ack 1503, win 661, options [nop,nop,TS val 2787361450 ecr 70101185], length 0
08:20:26.568834 IP 74.125.225.91.http > 192.168.0.100.58394: Flags [.], seq 1157:2575, ack 1503, win 661, options [nop,nop,TS val 2787361454 ecr 70101185], length 1418: HTTP: HTTP/1.1 200 OK
08:20:26.569104 IP 74.125.225.91.http > 192.168.0.100.58394: Flags [.], seq 2575:3993, ack 1503, win 661, options [nop,nop,TS val 2787361454 ecr 70101185], length 1418: HTTP
08:20:26.569215 IP 192.168.0.100.58394 > 74.125.225.91.http: Flags [.], ack 3993, win 8103, options [nop,nop,TS val 70101248 ecr 2787361454], length 0
08:20:26.569395 IP 74.125.225.91.http > 192.168.0.100.58394: Flags [P.], seq 3993:4227, ack 1503, win 661, options [nop,nop,TS val 2787361454 ecr 70101185], length 234: HTTP
08:20:26.569467 IP 192.168.0.100.58394 > 74.125.225.91.http: Flags [.], ack 4227, win 8177, options [nop,nop,TS val 70101248 ecr 2787361454], length 0
08:20:26.583904 IP 205.251.242.54.http > 192.168.0.100.58390: Flags [.], seq 42091:43551, ack 829, win 32768, length 1460: HTTP
08:20:26.583962 IP 192.168.0.100.58390 > 205.251.242.54.http: Flags [.], ack 43551, win 16292, length 0
08:20:26.584221 IP 205.251.242.54.http > 192.168.0.100.58390: Flags [.], seq 43551:45011, ack 829, win 32768, length 1460: HTTP
08:20:26.584328 IP 192.168.0.100.58390 > 205.251.242.54.http: Flags [.], ack 45011, win 16384, length 0
08:20:26.585099 IP 205.251.242.54.http > 192.168.0.100.58390: Flags [.], seq 45011:46471, ack 829, win 32768, length 1460: HTTP
08:20:26.585261 IP 205.251.242.54.http > 192.168.0.100.58390: Flags [.], seq 46471:47931, ack 829, win 32768, length 1460: HTTP
08:20:26.585282 IP 192.168.0.100.58390 > 205.251.242.54.http: Flags [.], ack 47931, win 16292, length 0
08:20:26.585413 IP 205.251.242.54.http > 192.168.0.100.58390: Flags [.], seq 47931:49391, ack 829, win 32768, length 1460: HTTP
08:20:26.585576 IP 205.251.242.54.http > 192.168.0.100.58390: Flags [.], seq 49391:50851, ack 829, win 32768, length 1460: HTTP
08:20:26.585607 IP 192.168.0.100.58390 > 205.251.242.54.http: Flags [.], ack 49391, win 16384, length 0
08:20:26.585708 IP 205.251.242.54.http > 192.168.0.100.58390: Flags [.], seq 50851:52311, ack 829, win 32768, length 1460: HTTP
08:20:26.585750 IP 192.168.0.100.58390 > 205.251.242.54.http: Flags [.], ack 52311, win 16292, length 0
08:20:26.586493 IP 205.251.242.54.http > 192.168.0.100.58390: Flags [.], seq 52311:53771, ack 829, win 32768, length 1460: HTTP
08:20:26.586641 IP 205.251.242.54.http > 192.168.0.100.58390: Flags [.], seq 53771:55231, ack 829, win 32768, length 1460: HTTP
08:20:26.586650 IP 192.168.0.100.58390 > 205.251.242.54.http: Flags [.], ack 53771, win 16384, length 0
08:20:26.586789 IP 205.251.242.54.http > 192.168.0.100.58390: Flags [.], seq 55231:56691, ack 829, win 32768, length 1460: HTTP
08:20:26.586823 IP 192.168.0.100.58390 > 205.251.242.54.http: Flags [.], ack 56691, win 16201, length 0
08:20:26.586852 IP 192.168.0.100.58390 > 205.251.242.54.http: Flags [.], ack 56691, win 16384, length 0
08:20:26.586955 IP 205.251.242.54.http > 192.168.0.100.58390: Flags [.], seq 56691:58151, ack 829, win 32768, length 1460: HTTP
08:20:26.587105 IP 205.251.242.54.http > 192.168.0.100.58390: Flags [.], seq 58151:59611, ack 829, win 32768, length 1460: HTTP
08:20:26.587137 IP 192.168.0.100.58390 > 205.251.242.54.http: Flags [.], ack 59611, win 16292, length 0
08:20:26.587275 IP 205.251.242.54.http > 192.168.0.100.58390: Flags [.], seq 59611:61071, ack 829, win 32768, length 1460: HTTP
08:20:26.587436 IP 205.251.242.54.http > 192.168.0.100.58390: Flags [.], seq 61071:62531, ack 829, win 32768, length 1460: HTTP
08:20:26.587447 IP 192.168.0.100.58390 > 205.251.242.54.http: Flags [.], ack 61071, win 16384, length 0
08:20:26.587592 IP 205.251.242.54.http > 192.168.0.100.58390: Flags [.], seq 62531:63991, ack 829, win 32768, length 1460: HTTP
08:20:26.587624 IP 192.168.0.100.58390 > 205.251.242.54.http: Flags [.], ack 63991, win 16292, length 0
08:20:26.587755 IP 205.251.242.54.http > 192.168.0.100.58390: Flags [.], seq 63991:65451, ack 829, win 32768, length 1460: HTTP
08:20:26.587789 IP 192.168.0.100.58390 > 205.251.242.54.http: Flags [.], ack 65451, win 16384, length 0
08:20:26.587900 IP 205.251.242.54.http > 192.168.0.100.58390: Flags [.], seq 65451:66911, ack 829, win 32768, length 1460: HTTP
08:20:26.588067 IP 205.251.242.54.http > 192.168.0.100.58390: Flags [.], seq 66911:68371, ack 829, win 32768, length 1460: HTTP
08:20:26.588094 IP 192.168.0.100.58390 > 205.251.242.54.http: Flags [.], ack 68371, win 16267, length 0
08:20:26.588198 IP 205.251.242.54.http > 192.168.0.100.58390: Flags [.], seq 68371:69831, ack 829, win 32768, length 1460: HTTP
08:20:26.588318 IP 192.168.0.100.58390 > 205.251.242.54.http: Flags [.], ack 69831, win 16384, length 0
08:20:26.589604 IP 192.168.0.100.58392 > 23.3.96.123.http: Flags [P.], seq 405:796, ack 1912, win 8192, options [nop,nop,TS val 70101267 ecr 1349529942], length 391: HTTP: GET /images/G/01/browser-scripts/site-wide-js-1.6.4-beacon/site-wide-14040847352._V1_.js HTTP/1.1
08:20:26.589815 IP 192.168.0.100.58391 > 23.3.96.123.http: Flags [P.], seq 413:787, ack 17093, win 8192, options [nop,nop,TS val 70101267 ecr 1349529947], length 374: HTTP: GET /images/G/01/s9-campaigns/s9-widget._V343312910_.css HTTP/1.1
08:20:26.591913 IP 205.251.242.54.http > 192.168.0.100.58390: Flags [P.], seq 69831:70797, ack 829, win 32768, length 966: HTTP
08:20:26.591965 IP 192.168.0.100.58390 > 205.251.242.54.http: Flags [.], ack 70797, win 16323, length 0
08:20:26.592501 IP 192.168.0.100.58395 > 173.194.46.59.http: Flags [S], seq 1504597456, win 65535, options [mss 1460,nop,wscale 4,nop,nop,TS val 70101269 ecr 0,sackOK,eol], length 0
08:20:26.615827 IP 23.3.96.123.http > 192.168.0.100.58391: Flags [.], seq 17093:18541, ack 787, win 8312, options [nop,nop,TS val 1349530235 ecr 70101267], length 1448: HTTP: HTTP/1.1 200 OK
08:20:26.616459 IP 23.3.96.123.http > 192.168.0.100.58391: Flags [.], seq 18541:19989, ack 787, win 8312, options [nop,nop,TS val 1349530235 ecr 70101267], length 1448: HTTP
08:20:26.616494 IP 192.168.0.100.58391 > 23.3.96.123.http: Flags [.], ack 19989, win 8101, options [nop,nop,TS val 70101292 ecr 1349530235], length 0
08:20:26.616799 IP 23.3.96.123.http > 192.168.0.100.58391: Flags [.], seq 19989:21437, ack 787, win 8312, options [nop,nop,TS val 1349530235 ecr 70101267], length 1448: HTTP
08:20:26.616853 IP 23.3.96.123.http > 192.168.0.100.58391: Flags [P.], seq 21437:22424, ack 787, win 8312, options [nop,nop,TS val 1349530235 ecr 70101267], length 987: HTTP
08:20:26.616875 IP 192.168.0.100.58391 > 23.3.96.123.http: Flags [.], ack 21437, win 8192, options [nop,nop,TS val 70101293 ecr 1349530235], length 0
08:20:26.616875 IP 192.168.0.100.58391 > 23.3.96.123.http: Flags [.], ack 22424, win 8130, options [nop,nop,TS val 70101293 ecr 1349530235], length 0
08:20:26.617792 IP 23.3.96.123.http > 192.168.0.100.58392: Flags [.], seq 1912:3360, ack 796, win 8312, options [nop,nop,TS val 1349530235 ecr 70101267], length 1448: HTTP: HTTP/1.1 200 OK
08:20:26.617930 IP 23.3.96.123.http > 192.168.0.100.58392: Flags [.], seq 3360:4808, ack 796, win 8312, options [nop,nop,TS val 1349530235 ecr 70101267], length 1448: HTTP
08:20:26.617962 IP 192.168.0.100.58392 > 23.3.96.123.http: Flags [.], ack 4808, win 8011, options [nop,nop,TS val 70101294 ecr 1349530235], length 0
08:20:26.618082 IP 23.3.96.123.http > 192.168.0.100.58392: Flags [.], seq 4808:6256, ack 796, win 8312, options [nop,nop,TS val 1349530235 ecr 70101267], length 1448: HTTP
08:20:26.618247 IP 23.3.96.123.http > 192.168.0.100.58392: Flags [.], seq 6256:7704, ack 796, win 8312, options [nop,nop,TS val 1349530235 ecr 70101267], length 1448: HTTP
08:20:26.618261 IP 192.168.0.100.58392 > 23.3.96.123.http: Flags [.], ack 6256, win 8176, options [nop,nop,TS val 70101294 ecr 1349530235], length 0
08:20:26.618385 IP 23.3.96.123.http > 192.168.0.100.58392: Flags [.], seq 7704:9152, ack 796, win 8312, options [nop,nop,TS val 1349530235 ecr 70101267], length 1448: HTTP
08:20:26.618413 IP 192.168.0.100.58392 > 23.3.96.123.http: Flags [.], ack 9152, win 7995, options [nop,nop,TS val 70101294 ecr 1349530235], length 0
08:20:26.618716 IP 23.3.96.123.http > 192.168.0.100.58392: Flags [.], seq 9152:10600, ack 796, win 8312, options [nop,nop,TS val 1349530235 ecr 70101267], length 1448: HTTP
08:20:26.618854 IP 23.3.96.123.http > 192.168.0.100.58392: Flags [.], seq 10600:12048, ack 796, win 8312, options [nop,nop,TS val 1349530235 ecr 70101267], length 1448: HTTP
08:20:26.618883 IP 192.168.0.100.58392 > 23.3.96.123.http: Flags [.], ack 12048, win 7814, options [nop,nop,TS val 70101294 ecr 1349530235], length 0
08:20:26.619016 IP 23.3.96.123.http > 192.168.0.100.58392: Flags [.], seq 12048:13496, ack 796, win 8312, options [nop,nop,TS val 1349530235 ecr 70101267], length 1448: HTTP
08:20:26.619043 IP 192.168.0.100.58392 > 23.3.96.123.http: Flags [.], ack 12048, win 8192, options [nop,nop,TS val 70101295 ecr 1349530235], length 0
08:20:26.619157 IP 23.3.96.123.http > 192.168.0.100.58392: Flags [.], seq 13496:14944, ack 796, win 8312, options [nop,nop,TS val 1349530235 ecr 70101267], length 1448: HTTP
08:20:26.619183 IP 192.168.0.100.58392 > 23.3.96.123.http: Flags [.], ack 14944, win 8011, options [nop,nop,TS val 70101295 ecr 1349530235], length 0
08:20:26.619835 IP 23.3.96.123.http > 192.168.0.100.58392: Flags [.], seq 14944:16392, ack 796, win 8312, options [nop,nop,TS val 1349530235 ecr 70101267], length 1448: HTTP
08:20:26.619968 IP 23.3.96.123.http > 192.168.0.100.58392: Flags [.], seq 16392:17840, ack 796, win 8312, options [nop,nop,TS val 1349530235 ecr 70101267], length 1448: HTTP
08:20:26.619979 IP 192.168.0.100.58391 > 23.3.96.123.http: Flags [P.], seq 787:1177, ack 22424, win 8192, options [nop,nop,TS val 70101295 ecr 1349530235], length 390: HTTP: GET /images/G/01/zeitgeist/static/css/zeitgeist-chart.2._V355684991_.css HTTP/1.1
08:20:26.619999 IP 192.168.0.100.58392 > 23.3.96.123.http: Flags [.], ack 17840, win 7830, options [nop,nop,TS val 70101295 ecr 1349530235], length 0
08:20:26.620025 IP 192.168.0.100.58392 > 23.3.96.123.http: Flags [.], ack 17840, win 8192, options [nop,nop,TS val 70101295 ecr 1349530235], length 0
08:20:26.620123 IP 23.3.96.123.http > 192.168.0.100.58392: Flags [.], seq 17840:19288, ack 796, win 8312, options [nop,nop,TS val 1349530235 ecr 70101267], length 1448: HTTP
08:20:26.620126 IP 173.194.46.59.http > 192.168.0.100.58395: Flags [S.], seq 1806764436, ack 1504597457, win 42540, options [mss 1430,sackOK,TS val 996717995 ecr 70101269,nop,wscale 6], length 0
08:20:26.620166 IP 192.168.0.100.58395 > 173.194.46.59.http: Flags [.], ack 1, win 8242, options [nop,nop,TS val 70101296 ecr 996717995], length 0
08:20:26.621525 IP 192.168.0.100.58395 > 173.194.46.59.http: Flags [P.], seq 1:774, ack 1, win 8242, options [nop,nop,TS val 70101297 ecr 996717995], length 773: HTTP: GET /879366/flashwrite_1_2.js HTTP/1.1
08:20:26.621982 IP 192.168.0.100.58396 > 54.230.33.13.http: Flags [S], seq 252161557, win 65535, options [mss 1460,nop,wscale 4,nop,nop,TS val 70101297 ecr 0,sackOK,eol], length 0
08:20:26.621983 IP 192.168.0.100.58397 > 54.230.33.13.http: Flags [S], seq 429109103, win 65535, options [mss 1460,nop,wscale 4,nop,nop,TS val 70101297 ecr 0,sackOK,eol], length 0
08:20:26.621983 IP 192.168.0.100.58398 > 54.230.33.13.http: Flags [S], seq 2682898012, win 65535, options [mss 1460,nop,wscale 4,nop,nop,TS val 70101297 ecr 0,sackOK,eol], length 0
08:20:26.643408 IP 23.3.96.123.http > 192.168.0.100.58392: Flags [.], seq 19288:20736, ack 796, win 8312, options [nop,nop,TS val 1349530262 ecr 70101294], length 1448: HTTP
08:20:26.643452 IP 192.168.0.100.58392 > 23.3.96.123.http: Flags [.], ack 20736, win 8101, options [nop,nop,TS val 70101318 ecr 1349530235], length 0
08:20:26.643759 IP 23.3.96.123.http > 192.168.0.100.58392: Flags [.], seq 20736:22184, ack 796, win 8312, options [nop,nop,TS val 1349530262 ecr 70101294], length 1448: HTTP
08:20:26.643861 IP 192.168.0.100.58392 > 23.3.96.123.http: Flags [.], ack 22184, win 8192, options [nop,nop,TS val 70101318 ecr 1349530262], length 0
08:20:26.644414 IP 23.3.96.123.http > 192.168.0.100.58392: Flags [.], seq 22184:23632, ack 796, win 8312, options [nop,nop,TS val 1349530262 ecr 70101294], length 1448: HTTP
08:20:26.645057 IP 23.3.96.123.http > 192.168.0.100.58392: Flags [.], seq 23632:25080, ack 796, win 8312, options [nop,nop,TS val 1349530262 ecr 70101294], length 1448: HTTP
08:20:26.645081 IP 192.168.0.100.58392 > 23.3.96.123.http: Flags [.], ack 25080, win 8101, options [nop,nop,TS val 70101319 ecr 1349530262], length 0
08:20:26.647347 IP 173.194.46.59.http > 192.168.0.100.58395: Flags [.], ack 774, win 661, options [nop,nop,TS val 996718024 ecr 70101297], length 0
08:20:26.648376 IP 173.194.46.59.http > 192.168.0.100.58395: Flags [P.], seq 1:753, ack 774, win 661, options [nop,nop,TS val 996718024 ecr 70101297], length 752: HTTP: HTTP/1.1 200 OK
08:20:26.648404 IP 192.168.0.100.58395 > 173.194.46.59.http: Flags [.], ack 753, win 8195, options [nop,nop,TS val 70101322 ecr 996718024], length 0
08:20:26.648484 IP 23.3.96.123.http > 192.168.0.100.58392: Flags [.], seq 25080:26528, ack 796, win 8312, options [nop,nop,TS val 1349530267 ecr 70101294], length 1448: HTTP
08:20:26.648688 IP 192.168.0.100.58392 > 23.3.96.123.http: Flags [.], ack 26528, win 8192, options [nop,nop,TS val 70101322 ecr 1349530267], length 0
08:20:26.651312 IP 23.3.96.123.http > 192.168.0.100.58392: Flags [.], seq 26528:27976, ack 796, win 8312, options [nop,nop,TS val 1349530267 ecr 70101294], length 1448: HTTP
08:20:26.651436 IP 23.3.96.123.http > 192.168.0.100.58392: Flags [.], seq 27976:29424, ack 796, win 8312, options [nop,nop,TS val 1349530267 ecr 70101294], length 1448: HTTP
08:20:26.651466 IP 192.168.0.100.58392 > 23.3.96.123.http: Flags [.], ack 29424, win 8101, options [nop,nop,TS val 70101324 ecr 1349530267], length 0
08:20:26.651573 IP 23.3.96.123.http > 192.168.0.100.58392: Flags [.], seq 29424:30872, ack 796, win 8312, options [nop,nop,TS val 1349530267 ecr 70101294], length 1448: HTTP
08:20:26.651679 IP 192.168.0.100.58392 > 23.3.96.123.http: Flags [.], ack 30872, win 8192, options [nop,nop,TS val 70101324 ecr 1349530267], length 0
08:20:26.651743 IP 23.3.96.123.http > 192.168.0.100.58392: Flags [.], seq 30872:32320, ack 796, win 8312, options [nop,nop,TS val 1349530267 ecr 70101294], length 1448: HTTP
08:20:26.651903 IP 23.3.96.123.http > 192.168.0.100.58392: Flags [.], seq 32320:33768, ack 796, win 8312, options [nop,nop,TS val 1349530267 ecr 70101294], length 1448: HTTP
08:20:26.651943 IP 192.168.0.100.58392 > 23.3.96.123.http: Flags [.], ack 33768, win 8101, options [nop,nop,TS val 70101324 ecr 1349530267], length 0
08:20:26.652052 IP 23.3.96.123.http > 192.168.0.100.58392: Flags [.], seq 33768:35216, ack 796, win 8312, options [nop,nop,TS val 1349530267 ecr 70101294], length 1448: HTTP
08:20:26.652130 IP 192.168.0.100.58392 > 23.3.96.123.http: Flags [.], ack 35216, win 8192, options [nop,nop,TS val 70101324 ecr 1349530267], length 0
08:20:26.652219 IP 23.3.96.123.http > 192.168.0.100.58392: Flags [.], seq 35216:36664, ack 796, win 8312, options [nop,nop,TS val 1349530267 ecr 70101294], length 1448: HTTP
08:20:26.652368 IP 23.3.96.123.http > 192.168.0.100.58392: Flags [.], seq 36664:38112, ack 796, win 8312, options [nop,nop,TS val 1349530267 ecr 70101294], length 1448: HTTP
08:20:26.652394 IP 192.168.0.100.58392 > 23.3.96.123.http: Flags [.], ack 38112, win 8101, options [nop,nop,TS val 70101325 ecr 1349530267], length 0
08:20:26.652543 IP 23.3.96.123.http > 192.168.0.100.58392: Flags [.], seq 38112:39560, ack 796, win 8312, options [nop,nop,TS val 1349530267 ecr 70101294], length 1448: HTTP
08:20:26.652631 IP 192.168.0.100.58392 > 23.3.96.123.http: Flags [.], ack 39560, win 8192, options [nop,nop,TS val 70101325 ecr 1349530267], length 0
08:20:26.652676 IP 23.3.96.123.http > 192.168.0.100.58392: Flags [.], seq 39560:41008, ack 796, win 8312, options [nop,nop,TS val 1349530267 ecr 70101295], length 1448: HTTP
08:20:26.653307 IP 23.3.96.123.http > 192.168.0.100.58392: Flags [.], seq 41008:42456, ack 796, win 8312, options [nop,nop,TS val 1349530267 ecr 70101295], length 1448: HTTP
08:20:26.653331 IP 192.168.0.100.58392 > 23.3.96.123.http: Flags [.], ack 42456, win 8101, options [nop,nop,TS val 70101325 ecr 1349530267], length 0
08:20:26.653441 IP 23.3.96.123.http > 192.168.0.100.58392: Flags [.], seq 42456:43904, ack 796, win 8312, options [nop,nop,TS val 1349530267 ecr 70101295], length 1448: HTTP
08:20:26.653540 IP 192.168.0.100.58392 > 23.3.96.123.http: Flags [.], ack 43904, win 8192, options [nop,nop,TS val 70101326 ecr 1349530267], length 0
08:20:26.653612 IP 23.3.96.123.http > 192.168.0.100.58392: Flags [.], seq 43904:45352, ack 796, win 8312, options [nop,nop,TS val 1349530267 ecr 70101295], length 1448: HTTP
08:20:26.653755 IP 23.3.96.123.http > 192.168.0.100.58392: Flags [.], seq 45352:46800, ack 796, win 8312, options [nop,nop,TS val 1349530267 ecr 70101295], length 1448: HTTP
08:20:26.653787 IP 192.168.0.100.58392 > 23.3.96.123.http: Flags [.], ack 46800, win 8101, options [nop,nop,TS val 70101326 ecr 1349530267], length 0
08:20:26.653922 IP 23.3.96.123.http > 192.168.0.100.58392: Flags [.], seq 46800:48248, ack 796, win 8312, options [nop,nop,TS val 1349530267 ecr 70101295], length 1448: HTTP
08:20:26.654015 IP 192.168.0.100.58392 > 23.3.96.123.http: Flags [.], ack 48248, win 8192, options [nop,nop,TS val 70101326 ecr 1349530267], length 0
08:20:26.654097 IP 23.3.96.123.http > 192.168.0.100.58392: Flags [.], seq 48248:49696, ack 796, win 8312, options [nop,nop,TS val 1349530267 ecr 70101295], length 1448: HTTP
08:20:26.654246 IP 23.3.96.123.http > 192.168.0.100.58392: Flags [.], seq 49696:51144, ack 796, win 8312, options [nop,nop,TS val 1349530267 ecr 70101295], length 1448: HTTP
08:20:26.654272 IP 192.168.0.100.58392 > 23.3.96.123.http: Flags [.], ack 51144, win 8101, options [nop,nop,TS val 70101326 ecr 1349530267], length 0
08:20:26.654408 IP 23.3.96.123.http > 192.168.0.100.58391: Flags [.], seq 22424:23872, ack 1177, win 8848, options [nop,nop,TS val 1349530267 ecr 70101295], length 1448: HTTP: HTTP/1.1 200 OK
08:20:26.654462 IP 23.3.96.123.http > 192.168.0.100.58391: Flags [P.], seq 23872:24059, ack 1177, win 8848, options [nop,nop,TS val 1349530267 ecr 70101295], length 187: HTTP
08:20:26.654465 IP 54.230.33.13.http > 192.168.0.100.58396: Flags [S.], seq 1392962561, ack 252161558, win 14480, options [mss 1460,sackOK,TS val 954148295 ecr 70101297,nop,wscale 7], length 0
